Sheet: Результаты поиска спутать
A1: 90.154465294883124 | B1: Reversed left context | C1: Reversed center | D1: Left context | E1: Center | F1: Punct | G1: Right context | H1: Title | I1: Количество | J1: Author | K1: Birthday | L1: Header | M1: Created | N1: Sphere | O1: Type | P1: Topic | Q1: Publication | R1: Publ_year | S1: Medium | T1: Ambiguity | U1: Full context
A2: 1.9316835637120944 | B2: окгел ьсюак от Я | C2: юатупс | D2: Я-то, каюсь, легко | E2: спутаю | G2: иланг-иланг с, допустим, ветивьером. | H2: Катя Метелица. Запах Мэра (1997) // «Столица», 1997.04.01 | I2: =IF(R[1]C[1]=RC[1],"",1) -> 1 | J2: Катя Метелица | L2: Запах Мэра | M2: 1997 | N2: публицистика , нехудожественная | O2: статья | P2: производство | Q2: «Столица» | R2: 1997.04.01 | S2: журнал | T2: омонимия не снята | U2: Я-то, каюсь, легко спутаю иланг-иланг с, допустим, ветивьером. [Катя Метелица. Запах Мэра (1997) // «Столица», 1997.04.01] [омонимия не снята]
A3: 3.9671406375649809 | B3: мюаФ ларизерп ен ьсядорто я | C3: латупс | D3: я отродясь не презирал ― Фаюм | E3: спутал | G3: с «вольным стихом», с верлибром | H3: Юлий Даниэль. Письма из заключения (1966-1970) | I3: =IF(R[1]C[1]=RC[1],"",1) -> 1 | J3: Юлий Даниэль | K3: 1925 | L3: Письма из заключения | M3: 1966-1970 | N3: бытовая , нехудожественная | O3: письмо личное | P3: частная жизнь | Q3: Юлий Даниэль. «Я всё сбиваюсь на литературу…» Письма из заключения. Стихи | R3: 2000 | S3: книга | T3: омонимия не снята | U3: А белый стих я отродясь не презирал ― Фаюм спутал с «вольным стихом», с верлибром. [Юлий Даниэль. Письма из заключения (1966-1970)] [омонимия не снята]
A4: 10.329702884296077 | B4: ил отч алахеоп ашырк хесв | C4: илатупС | D4: всех крыша поехала, что ли? | E4: Спутали | G4: вы меня с кем-то! ― Мы | H4: Н. Леонов, А. Макеев. Гроссмейстер сыска (2003) | I4: =IF(R[1]C[1]=RC[1],"",1) -> 1 | J4: Н. Леонов, А. Макеев | K4: 1933 | L4: Гроссмейстер сыска | M4: 2003 | N4: художественная | O4: роман | Q4: Н. Леонов, А. Макеев. Гроссмейстер сыска | R4: 2003 | S4: книга | T4: омонимия не снята | U4: ― У вас у всех крыша поехала, что ли? Спутали вы меня с кем-то! ― Мы, может, и спутали, ― заметил Гуров. [Н. Леонов, А. Макеев. Гроссмейстер сыска (2003)] [омонимия не снята]
A5: 11.028756963272823 | B5: янем от-мек с ыТ китоК | C5: алатупс | D5: Котик? Ты с кем-то меня | E5: спутала | F5: . | G5: ― Брось! | H5: Виорель Ломов. Музей // «Октябрь», 2002 | I5: =IF(#REF!=RC[1],"",1) -> #REF! | J5: Виорель Ломов | L5: Музей | M5: 2002 | N5: художественная | O5: повесть | Q5: «Октябрь» | R5: 2002 | S5: журнал | T5: омонимия не снята | U5: ― Котик? Ты с кем-то меня спутала. ― Брось! [Виорель Ломов. Музей // «Октябрь», 2002] [омонимия не снята]
A6: 13.151087146148853 | B6: от-мек с отч мот о | C6: илатупс | D6: о том, что с кем-то | E6: спутали | F6: , | G6: лучше не заикаться, ― убили и | H6: Владимир Маканин. Голоса (1977) | I6: =IF(R[1]C[1]=RC[1],"",1) -> 1 | J6: Владимир Маканин | K6: 1937 | L6: Голоса | M6: 1977 | N6: художественная | O6: повесть | Q6: Маканин В. Лаз | R6: 1998 | S6: книга | T6: омонимия не снята | U6: Она понимала, что голосить можно, плакать можно, убиваться можно, но ни о Божьей матушке, ни о том, что с кем-то спутали, лучше не заикаться, ― убили и убили, земля ему пухом. [Владимир Маканин. Голоса (1977)] [омонимия не снята]
A7: 13.956316046081518 | B7: еН ыппург ьлетидовокур ьдев ыт | C7: латупс | D7: ты ведь руководитель группы? Не | E7: спутал | F7: ?» | G7: «Я главный архитектор проекта», ― ответил | H7: Анатолий Найман. Все и каждый // «Октябрь», 2003 | I7: =IF(R[1]C[1]=RC[1],"",1) -> 1 | J7: Анатолий Найман | K7: 1936 | L7: Все и каждый | M7: 2003 | N7: художественная | O7: роман | Q7: «Октябрь» | R7: 2003 | S7: журнал | T7: омонимия не снята | U7: Я правильно говорю ― ты ведь руководитель группы? Не спутал?» «Я главный архитектор проекта», ― ответил Андрей и подумал, что ничего тот не путал, а сказал, что собирался сказать. [Анатолий Найман. Все и каждый // «Октябрь», 2003] [омонимия не снята]
A8: 15.268988704981879 | B8: ен мигурд микак с ин | C8: ьшеатупс | D8: ни с каким другим не | E8: спутаешь | F8: . | H8: Г. В. Адамович. Борис Зайцев (1955) | I8: =IF(R[1]C[1]=RC[1],"",1) -> 1 | J8: Г. В. Адамович | K8: 1892 | L8: Борис Зайцев | M8: 1955 | N8: публицистика , нехудожественная | O8: статья | P8: искусство и культура , филология , культурология | Q8: Адамович Г. В. Одиночество и свобода | R8: 2002 | S8: книга | T8: омонимия не снята | U8: Он полностью был самим собой, голос его ни с каким другим не спутаешь. [Г. В. Адамович. Борис Зайцев (1955)] [омонимия не снята]
A9: 15.562347211345129 | B9: Я еталпыв хи бо яинешер | C9: латупс | D9: решения об их выплате. Я | E9: спутал | G9: Челябинск и Свердловск. Челябинска у | H9: коллективный. Форум: Энергосбыты (2008) | I9: =IF(R[1]C[1]=RC[1],"",1) -> 1 | J9: коллективный | L9: Форум: Энергосбыты | M9: 2008 | N9: электронная коммуникация , нехудожественная | O9: форум | P9: бизнес, коммерция, экономика, финансы | R9: 2008 | S9: электронный текст | T9: омонимия не снята | U9: [poter, nick] 2. Выплатить дивиденды по привилегированным акциям Общества по результатам 2009 года в размер 0, 004564 рублей на одну обыкновенную акцию Общества в денежной форме в течение 60 дней со дня принятия решения об их выплате. Я спутал Челябинск и Свердловск. Челябинска у меня нет. [коллективный. Форум: Энергосбыты (2008)] [омонимия не снята]
A10: 18.430010130936648 | B10: ен йеьч с ин укчур | C10: ьшеатупс | D10: ручку ни с чьей не | E10: спутаешь | F10: . | H10: Дина Сабитова. Где нет зимы (2011) | I10: =IF(R[1]C[1]=RC[1],"",1) -> 1 | J10: Дина Сабитова | K10: 1969 | L10: Где нет зимы | M10: 2011 | N10: художественная | O10: повесть | Q10: Д. Р. Сабитова. Цирк в шкатулке | R10: 2007 | S10: книга | T10: омонимия не снята | U10: Такую ручку ни с чьей не спутаешь. [Дина Сабитова. Где нет зимы (2011)] [омонимия не снята]
A11: 19.558455720756342 | B11: ьджоД | C11: латупс | D11: Дождь | E11: спутал | G11: планы премьера Касьянов полюбил новосибирский | H11: Елена Лашкина. Дождь спутал планы премьера (2003) // «Российская газета», 2003.04.03 | I11: =IF(R[1]C[1]=RC[1],"",1) -> 1 | J11: Елена Лашкина | L11: Дождь спутал планы премьера | M11: 2003 | N11: публицистика , нехудожественная | O11: статья | P11: политика и общественная жизнь | Q11: «Российская газета» | R11: 2003.04.03 | S11: газета | T11: омонимия не снята | U11: Дождь спутал планы премьера Касьянов полюбил новосибирский хлеб и поругал московских силовиков [Елена Лашкина. Дождь спутал планы премьера (2003) // «Российская газета», 2003.04.03] [омонимия не снята]
A12: 20.384010692843702 | B12: ябет я тичанЗ ьсолаврыв оген | C12: латупс | D12: него вырвалось: «Значит, я тебя | E12: спутал | G12: с другой». | H12: Владимир Шахиджанян. 1001 вопрос про ЭТО (№№ 501-1001) (1999) | I12: =IF(R[1]C[1]=RC[1],"",1) -> 1 | J12: Владимир Шахиджанян | K12: 1940 | L12: 1001 вопрос про ЭТО (№№ 501-1001) | M12: 1999 | N12: учебно-научная , нехудожественная | O12: учебное пособие | P12: здоровье и медицина | Q12: 1001 вопрос про ЭТО | R12: 1999 | S12: книга | T12: омонимия не снята | U12: А у него вырвалось: «Значит, я тебя спутал с другой». [Владимир Шахиджанян. 1001 вопрос про ЭТО (№№ 501-1001) (1999)] [омонимия не снята]
A13: 23.148603104953224 | B13: отч йокбишо йолам йот С | C13: латупс | D13: С той малой ошибкой, что | E13: спутал | G13: шофёра с ездоком, вещий старик | H13: А. И. Солженицын. Архипелаг ГУЛаг (1958-1973) | I13: =IF(R[1]C[1]=RC[1],"",1) -> 1 | J13: А. И. Солженицын | K13: 1918 | L13: Архипелаг ГУЛаг | M13: 1958-1973 | N13: публицистика , нехудожественная | O13: монография | P13: политика и общественная жизнь | S13: книга | T13: омонимия не снята | U13: 23 С той малой ошибкой, что спутал шофёра с ездоком, вещий старик почти ведь и не ошибся! [А. И. Солженицын. Архипелаг ГУЛаг (1958-1973)] [омонимия не снята]
A14: 23.426869509338154 | B14: ен мигурд микак с ин | C14: юатупс | D14: ни с каким другим не | E14: спутаю | F14: . | H14: Владимир Соловьев. Три еврея, или Утешение в слезах. Роман с эпиграфами (1975-1998) | I14: =IF(R[1]C[1]=RC[1],"",1) -> 1 | J14: Владимир Соловьев | K14: 1942 | L14: Три еврея, или Утешение в слезах. Роман с эпиграфами | M14: 1975-1998 | N14: художественная | O14: роман | Q14: Владимир Соловьев. Три еврея, или Утешение в слезах. Роман с эпиграфами | R14: 2002 | S14: книга | T14: омонимия не снята | U14: Это все равно кто ― грузчик, секретарь Союза писателей, генеральный секретарь партии ― почерк один и тот же, я его легко узнаю, ни с каким другим не спутаю. [Владимир Соловьев. Три еврея, или Утешение в слезах. Роман с эпиграфами (1975-1998)] [омонимия не снята]
A15: 28.438078138697787 | B15: окьлоТ иизанмиг ароткерид аныс ушаС | C15: алатупс | D15: Сашу, сына директора гимназии. Только | E15: спутала | G15: сначала маму с Аней. Две | H15: З. И. Воскресенская. Сердце матери (1963-1965) | I15: =IF(R[1]C[1]=RC[1],"",1) -> 1 | J15: З. И. Воскресенская | K15: 1907 | L15: Сердце матери | M15: 1963-1965 | N15: художественная | O15: повесть | Q15: Воскресенская З. И. Сердце матери | R15: 1986 | S15: книга | T15: омонимия не снята | U15: В барышне-крестьянке она сразу угадала Олину подружку Сашу Щербо, в Дон Кихоте ― Митиного приятеля Алешу Яковлева и, конечно, узнала в маленьком гноме пятилетнего Сашу, сына директора гимназии. Только спутала сначала маму с Аней. Две тоненькие елочки, закутанные в зеленую бахрому, танцевали лучше всех, но у мамы-елочки из-под зеленой шляпы выбилась белая прядь волос. [З. И. Воскресенская. Сердце матери (1963-1965)] [омонимия не снята]
A16: 29.361588790875302 | B16: ынвонавИ ыниН аругиф итаК и | C16: алатупс | D16: и Кати, фигура Нины Ивановны | E16: спутала | G16: ее мысли. | H16: Татьяна Моспан. Подиум (2000) | I16: =IF(#REF!=RC[1],"",1) -> #REF! | J16: Татьяна Моспан | L16: Подиум | M16: 2000 | N16: художественная | O16: роман | Q16: Татьяна Моспан. Подиум | R16: 2000 | S16: книга | T16: омонимия не снята | U16: Катя хотела что-то спросить, но не успела: внезапно вынырнувшая откуда-то сзади, из-за спин Наташи и Кати, фигура Нины Ивановны спутала ее мысли. [Татьяна Моспан. Подиум (2000)] [омонимия не снята]
A17: 30.295229970028849 | B17: чивотодеФ римидалВ | C17: илатупс | D17: ― Владимир Федотович, | E17: спутали | F17: , | G17: за кого-то другого приняли… ― Не | H17: Павел Сиркес. Труба исхода (1990-1999) | I17: =IF(R[1]C[1]=RC[1],"",1) -> 1 | J17: Павел Сиркес | K17: 1932 | L17: Труба исхода | M17: 1990-1999 | N17: публицистика , нехудожественная | O17: мемуары | S17: электронный текст | T17: омонимия не снята | U17: ― Владимир Федотович, спутали, за кого-то другого приняли… ― Не спутал ― мы с тобой воевали. ― Вы с отцом моим воевали. [Павел Сиркес. Труба исхода (1990-1999)] [омонимия не снята]
A18: 32.43925748613281 | B18: ытрак есв морту ми ым | C18: илатупс | D18: мы им утром все карты | E18: спутали | F18: . | H18: Константин Симонов. Так называемая личная жизнь/ Четыре шага (1956-1965) | I18: =IF(R[1]C[1]=RC[1],"",1) -> 1 | J18: Константин Симонов | K18: 1915 | L18: Так называемая личная жизнь/ Четыре шага | M18: 1956-1965 | N18: художественная | O18: повесть | Q18: Симонов К. М. Собр. соч.: В 10 т. Т.7 | R18: 1982 | S18: книга | T18: омонимия не снята | U18: Показывает, что мы им утром все карты спутали. [Константин Симонов. Так называемая личная жизнь/ Четыре шага (1956-1965)] [омонимия не снята]
A19: 34.188683561063208 | B19: акнакирема ьтыб тежоМ | C19: латупс | D19: ― Может быть, американка | E19: спутал | F19: , ― | G19: сказал Ершов и стал драть | H19: Василий Гроссман. Жизнь и судьба, ч. 1 (1960) | I19: =IF(R[1]C[1]=RC[1],"",1) -> 1 | J19: Василий Гроссман | K19: 1905 | L19: Жизнь и судьба, ч. 1 | M19: 1960 | N19: художественная | O19: роман | Q19: Гроссман В. Жизнь и судьба | R19: 1992 | S19: книга | T19: омонимия снята | U19: ― Может быть, американка спутал, ― сказал Ершов и стал драть ногтями грудь. ― Может быть, наоборот, Коминтерн расширяется. [Василий Гроссман. Жизнь и судьба, ч. 1 (1960)] [омонимия снята]
A20: 35.548374681653485 | B20: ыреткатнок еонреваН | C20: илатупс | D20: Наверное, контактеры | E20: спутали | G20: созвездие со звездным скоплением. | H20: Феликс Эльдемуров. Беседы о спиритизме // «Наука и религия», 1992 | I20: =IF(R[1]C[1]=RC[1],"",1) -> 1 | J20: Феликс Эльдемуров | K20: 1957 | L20: Беседы о спиритизме | M20: 1992 | N20: публицистика, нехудожественная | O20: статья | P20: астрология, парапсихология, эзотерика | Q20: «Наука и религия» | R20: 1992 | S20: журнал | T20: омонимия не снята | U20: Наверное, контактеры спутали созвездие со звездным скоплением. [Феликс Эльдемуров. Беседы о спиритизме // «Наука и религия», 1992] [омонимия не снята]
A21: 36.729611666108816 | B21: ен ценок и уничнок оН | C21: ьшеатупс | D21: Но кончину и конец не | E21: спутаешь | F21: . | G21: Правда, не у каждого. | H21: Галина Шергова. …Об известных всем (2002-2004) | I21: =IF(R[1]C[1]=RC[1],"",1) -> 1 | J21: Галина Шергова | K21: 1923 | L21: …Об известных всем | M21: 2002-2004 | N21: публицистика , нехудожественная | O21: мемуары | Q21: Г. Шергова. …Об известных всем | R21: 2004 | S21: книга | T21: омонимия не снята | U21: Как горько, что задумываемся мы сплошь и рядом уже после чьей-то кончины. Но кончину и конец не спутаешь. Правда, не у каждого. [Галина Шергова. …Об известных всем (2002-2004)] [омонимия не снята]
A22: 39.520801251108828 | B22: есв я ьтыб тежоМ | C22: латупс | D22: Может быть, я все | E22: спутал | G22: и это было не с | H22: Виктор Розов. Удивление перед жизнью (1960-2000) | I22: =IF(R[1]C[1]=RC[1],"",1) -> 1 | J22: Виктор Розов | K22: 1913 | L22: Удивление перед жизнью | M22: 1960-2000 | N22: публицистика , нехудожественная | O22: мемуары | Q22: Виктор Розов. Удивление перед жизнью | R22: 2000 | S22: книга | T22: омонимия не снята | U22: Может быть, я все спутал и это было не с вами, а с Катаевым, Граниным или даже со мной, ― не в этом дело. [Виктор Розов. Удивление перед жизнью (1960-2000)] [омонимия не снята]
A23: 40.535909228608716 | B23: ен хи ишаН икноров юатичс | C23: ьшеатупс | D23: считаю воронки. Наши, их не | E23: спутаешь | F23: . | G23: Несколько прямых попаданий в окоп | H23: Г. Я. Бакланов. Пядь земли (1959) | I23: =IF(R[1]C[1]=RC[1],"",1) -> 1 | J23: Г. Я. Бакланов | K23: 1923 | L23: Пядь земли | M23: 1959 | N23: художественная | O23: повесть | Q23: Григорий Яковлевич Бакланов. Пядь земли. Повести. Роман. Рассказы | R23: 1983 | S23: книга | T23: омонимия не снята | U23: Я с удовольствием хожу по брошенным орудийным окопам, считаю воронки. Наши, их не спутаешь. Несколько прямых попаданий в окоп. [Г. Я. Бакланов. Пядь земли (1959)] [омонимия не снята]
A24: 42.040083963381669 | B24: яам 52 радУ хакур в | C24: латупс | D24: в руках. Удар 25 мая | E24: спутал | G24: все карты. И до октября | H24: Б. Г. Бажанов. Воспоминания бывшего секретаря Сталина (1980) | I24: =IF(R[1]C[1]=RC[1],"",1) -> 1 | J24: Б. Г. Бажанов | K24: 1900 | L24: Воспоминания бывшего секретаря Сталина | M24: 1980 | N24: публицистика, нехудожественная | O24: мемуары | Q24: Борис Бажанов. Воспоминания бывшего секретаря Сталина | R24: 1992 | S24: книга | T24: омонимия не снята | U24: Но затем поправился, 27 марта 1922 года сделал на съезде политический отчет ЦК, и все держал в руках. Удар 25 мая спутал все карты. И до октября 1922 года Ленин практически был не у дел, и заключение врачей (конечно, секретное, для членов Политбюро, а не для страны) было, что это начало конца. [Б. Г. Бажанов. Воспоминания бывшего секретаря Сталина (1980)] [омонимия не снята]
A25: 46.042256945891111 | B25: кафбар ино умеовс увтсежевен оп | C25: илатупс | D25: по невежеству своему они рабфак | E25: спутали | G25: с домзаком…" | H25: Анатолий Азольский. Лопушок // «Новый Мир», 1998 | I25: =IF(#REF!=RC[1],"",1) -> #REF! | J25: Анатолий Азольский | K25: 1930 | L25: Лопушок | M25: 1998 | N25: художественная | O25: роман | Q25: «Новый Мир» | R25: 1998 | S25: журнал | T25: омонимия снята | U25: Неблагодарные односельчане послали его в город, на рабфак, по невежеству своему они рабфак спутали с домзаком…" [Анатолий Азольский. Лопушок // «Новый Мир», 1998] [омонимия снята]
A26: 46.234171484611572 | B26: ачярогс укитЭ | C26: латупс | D26: Этику сгоряча | E26: спутал | G26: с эстетикой ― такой необдуманный, но | H26: С. Б. Рассадин. Книга прощаний. Воспоминания о друзьях и не только о них (2004-2008) | I26: =IF(R[1]C[1]=RC[1],"",1) -> 1 | J26: С. Б. Рассадин | K26: 1935 | L26: Книга прощаний. Воспоминания о друзьях и не только о них | M26: 2004-2008 | N26: публицистика, нехудожественная | O26: мемуары | P26: искусство и культура, частная жизнь, администрация и управление | Q26: Рассадин С. Б. Книга прощаний. Воспоминания. М.: Текст, 2009 | R26: 2009 | S26: книга | T26: омонимия не снята | U26: Этику сгоряча спутал с эстетикой ― такой необдуманный, но и такой понятный порыв тонко чувствующего интеллигента… [С. Б. Рассадин. Книга прощаний. Воспоминания о друзьях и не только о них (2004-2008)] [омонимия не снята]

Sheet: Сводка по авт."спутать"
A3: Названия строк | B3: Количество по полю Количество
A4: А. И. Алдан-Семенов | B4: 1
A5: А. И. Солженицын | B5: 1
A6: Александра Маринина | B6: 1
A7: Алексей Владимиров | B7: 1
A8: Анатолий Азольский | B8: 1
A9: Анатолий Найман | B9: 2
A10: Аркадий Стругацкий, Борис Стругацкий | B10: 1
A11: Б. Г. Бажанов | B11: 1
A12: Борис Васильев | B12: 1
A13: Василий Гроссман | B13: 1
A14: Василий Соловьев | B14: 1
A15: Виктор Розов | B15: 1
A16: Виорель Ломов | B16: 1
A17: Владимир Маканин | B17: 2
A18: Владимир Рецептер | B18: 1
A19: Владимир Соловьев | B19: 1
A20: Владимир Чивилихин | B20: 1
A21: Владимир Шахиджанян | B21: 1
A22: Г. В. Адамович | B22: 1
A23: Г. Я. Бакланов | B23: 1
A24: Гавриил Троепольский | B24: 1
A25: Галина Шергова | B25: 1
A26: Д. С. Лихачев | B26: 1
A27: Дина Рубина | B27: 1
A28: Дина Сабитова | B28: 1
A29: Елена Лашкина | B29: 1
A30: З. И. Воскресенская | B30: 1
A31: Катя Метелица | B31: 1
A32: коллективный | B32: 1
A33: Константин Симонов | B33: 1
A34: Н. Леонов, А. Макеев | B34: 1
A35: Н. Садур | B35: 1
A36: Ольга Славникова | B36: 1
A37: Ольга Фам | B37: 1
A38: Павел Власов | B38: 1
A39: Павел Сиркес | B39: 1
A40: С. А. Дангулов | B40: 1
A41: С. Б. Рассадин | B41: 1
A42: Светлана Василенко | B42: 1
A43: Т. В. Доронина | B43: 1
A44: Татьяна Моспан | B44: 1
A45: Фазиль Искандер | B45: 3
A46: Феликс Эльдемуров | B46: 1
A47: Эльдар Рязанов | B47: 1
A48: Юлий Даниэль | B48: 1
A49: Я. Розенцвейг, С. Венецкий | B49: 1
A50: (пусто)
A51: Общий итог | B51: 50

Sheet: Результаты поиска перепутать
A1: 29.626467814069144 | B1: Reversed left context | C1: Reversed center | D1: Left context | E1: Center | F1: Punct | G1: Right context | H1: Title | I1: Количество | J1: Author | K1: Birthday | L1: Header | M1: Created | N1: Sphere | O1: Type | P1: Topic | Q1: Publication | R1: Publ_year | S1: Medium | T1: Ambiguity | U1: Full context
A2: 1.6978292082347801 | B2: есв кичьлаМ ьнед нидо в | C2: театупереп | D2: в один день! Мальчик все | E2: перепутает | F2: ! | G2: ― Вот-вот, ― обиделся учитель. | H2: Юрий Дружков (Постников). Приключения Карандаша и Самоделкина (1964) | I2: =IF(R[1]C[1]=RC[1],"",1) -> 1 | J2: Ольга Мачнева | L2: Чем моложе препод, тем он коварнее | M2: 2003 | N2: публицистика , нехудожественная | O2: статья | P2: политика и общественная жизнь | Q2: «Вечерняя Казань» | R2: 2003.01.05 | S2: газета | T2: омонимия не снята | U2: Пришла тут ко мне одна девушка на экзамен и перепутала «вольты» с «мегапаскалями», а «глухую заделку» ― с «заземлением». [Ольга Мачнева. Чем моложе препод, тем он коварнее (2003) // «Вечерняя Казань», 2003.01.05] [омонимия не снята]
A3: 3.6608122718600811 | B3: ен юровог ыВ | C3: илатупереп | D3: Вы, говорю, не | E3: перепутали | F3: , | G3: что значит быть племянником и | H3: Галина Щербакова. Loveстория (1996) | I3: =IF(R[1]C[1]=RC[1],"",1) -> 1 | J3: Сергей Носов | K3: 1957 | L3: Фигурные скобки | M3: 2015 | N3: художественная | O3: роман | Q3: С. А. Носов. Фигурные скобки | R3: 2015 | S3: книга | T3: омонимия не снята | U3: — Евгений Геннадьевич, это я с вами вчера говорила, это я вам заказала на адлерский поезд, а наши все перепутали, послали машину не туда, на Московский вокзал, вы простите, но мы вас уже не успеем встретить… сможете без нас? [Сергей Носов. Фигурные скобки (2015)] [омонимия не снята]
A4: 9.6592258865765288 | B4: ен адгокин исуг ьрепеТ | C4: тюатупереп | D4: Теперь гуси никогда не | E4: перепутают | G4: других людей со своими воспитателями | H4: Александр Волков. Рассказы о животных, и не только о них: Чудесное путешествие Кристиана с дикими гусями // «Знание ― сила», 2003 | I4: =IF(R[1]C[1]=RC[1],"",1) -> 1 | J4: Эльдар Рязанов, Эмиль Брагинский | K4: 1927, 1921 | L4: Тихие омуты | M4: 1998 | N4: художественная | O4: киноповесть | Q4: Эльдар Рязанов, Эмиль Брагинский. Тихие омуты | R4: 1999 | S4: книга | T4: омонимия не снята | U4: Антон Михайлович не появлялся. ― Перепутал вагон, что ли! ― в сердцах воскликнула Полина Сергеевна, обращаясь к проводнице. [Эльдар Рязанов, Эмиль Брагинский. Тихие омуты (1998)] [омонимия не снята]
A5: 9.8660655666498513 | B5: яслялвяоп ен чиволйахиМ нотнА | C5: латупереП | D5: Антон Михайлович не появлялся. ― | E5: Перепутал | G5: вагон, что ли! ― в сердцах | H5: Эльдар Рязанов, Эмиль Брагинский. Тихие омуты (1998) | I5: =IF(R[1]C[1]=RC[1],"",1) -> 1 | J5: Александра Маринина | K5: 1957 | L5: За все надо платить | M5: 1995 | N5: художественная | O5: роман | Q5: Александра Маринина. За все надо платить | R5: 2006 | S5: книга | T5: омонимия не снята | U5: Идиотка, она что-то забыла, что-то не так запомнила, перепутала какое-то название! [Александра Маринина. За все надо платить (1995)] [омонимия не снята]
A6: 13.302166964573935 | B6: ыв еонреваН | C6: илатупереп | D6: ― Наверное, вы | E6: перепутали | G6: меня с той ученой дамой | H6: Наталья Александрова. Последний ученик да Винчи (2010) | I6: =IF(R[1]C[1]=RC[1],"",1) -> 1 | J6: В. В. Голявкин | K6: 1929 | L6: Веселые ребята | M6: 1973 | N6: художественная | O6: рассказ | Q6: Виктор Голявкин. «Большие скорости». Роман, рассказы | R6: 1988 | S6: книга | T6: омонимия не снята | U6: Звоню в телевизионное ателье на другой день, спрашиваю техника, интересуюсь, почему он вчера не пришел, а он мне весело отвечает, что перепутал мой адрес. ― А вы больше не перепутаете? ― спрашиваю. [В. В. Голявкин. Веселые ребята (1973)] [омонимия не снята]
A7: 13.649365645873978 | B7: ёсв есв отч ьсолинсяыв гурдв | C7: илатупереп | D7: вдруг выяснилось, что все всё | E7: перепутали | F7: , | G7: то ли Света все перепутала | H7: Алексей Макушинский. Город в долине (2012) | I7: =IF(R[1]C[1]=RC[1],"",1) -> 1 | J7: С. Л. Рябцева | L7: Дети восьмидесятых | M7: 1989 | N7: публицистика, нехудожественная | O7: монография | P7: образование | Q7: С. Л. Рябцева. Дети восьмидесятых | R7: 1989 | S7: книга | T7: омонимия не снята | U7: Молча показываю нелепицу ― ахают, удивляются: ― Как же так… ― Перепутал… ― Забыл… Крепко нас избили. [С. Л. Рябцева. Дети восьмидесятых (1989)] [омонимия не снята]
A8: 15.731175774435179 | B8: я отэ тежоМ тнатьлуснок как | C8: алатупереп | D8: как консультант. Может, это я | E8: перепутала | F8: . | G8: СЫН. | H8: Людмила Петрушевская. Свидание (1997) | I8: =IF(R[1]C[1]=RC[1],"",1) -> 1 | J8: Даниил Гранин | K8: 1919 | L8: Зубр | M8: 1987 | N8: художественная | O8: повесть | Q8: Гранин Д.А. Зубр: Повесть | R8: 1987 | S8: книга | T8: омонимия снята | U8: Сперва специалисты сказали, что, очевидно, я перепутал: с подобной надписью медали давались сразу после победы участникам кампании 1812 года, серебряные и бронзовые. [Даниил Гранин. Зубр (1987)] [омонимия снята]
A9: 18.008441677349296 | C9: латупереП | E9: Перепутал | G9: команды, понял как команду на | H9: Андрей Тарасов. С пистолетом на борту // «Знание - сила», 2011 | I9: =IF(R[1]C[1]=RC[1],"",1) -> 1 | J9: Эдвард Радзинский | K9: 1936 | L9: Наш Декамерон | M9: 1980-1990 | N9: художественная | O9: роман | Q9: Радзинский Э. Собрание сочинений: В 7 т. Т.3 | R9: 1998 | S9: книга | T9: омонимия не снята | U9: ― Что случилось? ― Перепутал портфели, ― злобно сказал З. ― И конечно, в портфеле что-то было! [Эдвард Радзинский. Наш Декамерон (1980-1990)] [омонимия не снята]
A10: 20.201799861904522 | B10: ьсоличулс отЧ | C10: латупереП | D10: ― Что случилось? ― | E10: Перепутал | G10: портфели, ― злобно сказал З. ― И | H10: Эдвард Радзинский. Наш Декамерон (1980-1990) | I10: =IF(R[1]C[1]=RC[1],"",1) -> 1 | J10: коллективный | L10: Форум: Гигиена души | M10: 2012 | N10: электронная коммуникация, нехудожественная | O10: форум, блог | P10: психология | S10: электронный текст | T10: омонимия не снята | U10: [ДаКар, жен] Я даже перепроверила, ту ли рассылку смотрю, не перепутала ли :)))))) . [коллективный. Форум: Гигиена души (2012)] [омонимия не снята]
A11: 22.523453742581356 | B11: набруК илА ондиВ | C11: латупереП | D11: Видно, Али Курбан. | E11: Перепутал | G11: ты. ― Може, и Курбан. | H11: Б. Л. Пастернак. Доктор Живаго (1945-1955) | I11: =IF(R[1]C[1]=RC[1],"",1) -> 1 | J11: Дарья Симонова | K11: 1972 | L11: Половецкие пляски | M11: 2002 | N11: художественная | O11: повесть | Q11: Дарья Симонова. Половецкие пляски | R11: 2002 | S11: книга | T11: омонимия не снята | U11: Но однажды Половецкая оконфузилась и после шестой банки перепутала одежки ― две кожаные куртки рядом, немудрено, ― залезла в карман к серьезному человеку, с суровым именем Макар, бывшему в этом доме персоной грата на все случаи жизни. [Дарья Симонова. Половецкие пляски (2002)] [омонимия не снята]
A12: 23.03828745493497 | B12: енс ов теавыб как ьтыб | C12: алатупереп | D12: быть, как бывает во сне, | E12: перепутала | G12: время и, придя уже после | H12: Марина Вишневецкая. Вышел месяц из тумана (1997) | I12: =IF(R[1]C[1]=RC[1],"",1) -> 1 | J12: Анатолий Приставкин | K12: 1931 | L12: Вагончик мой дальний | M12: 2005 | N12: художественная | O12: повесть | Q12: «Октябрь» | R12: 2005 | S12: книга | T12: омонимия не снята | U12: ― Отнесу, ― натянуто произнес он. ― Не перепутаешь? Костик замолчал. [Анатолий Приставкин. Вагончик мой дальний (2005)] [омонимия не снята]
A13: 24.464964311544101 | B13: ен откин ее ьрепеТ | C13: латупереп | D13: Теперь ее никто не | E13: перепутал | G13: бы со студенткой, в лице | H13: Елизавета Козырева. Дамская охота (2001) | I13: =IF(R[1]C[1]=RC[1],"",1) -> 1 | J13: Елизавета Козырева | L13: Дамская охота | M13: 2001 | N13: художественная | O13: роман | Q13: Елизавета Козырева. Дамская охота | R13: 2001 | S13: книга | T13: омонимия не снята | U13: Теперь ее никто не перепутал бы со студенткой, в лице ― ничего юного и беззащитного. [Елизавета Козырева. Дамская охота (2001)] [омонимия не снята]
A14: 25.074079999460295 | B14: гом еогонм лыбаз утсорпоп вокненнА | C14: латупереп | D14: Анненков попросту забыл, многое мог | E14: перепутал | G14: за давностью лет, но несомненно | H14: В. П. Дорофеев. П. В. Анненков и его воспоминания. Вступительная статья (1960) | I14: =IF(R[1]C[1]=RC[1],"",1) -> 1 | J14: Лидия Смирнова | K14: 1913 | L14: Моя любовь | M14: 1997 | N14: публицистика , нехудожественная | O14: мемуары | Q14: Лидия Смирнова. Моя любовь | R14: 1997 | S14: книга | T14: омонимия не снята | U14: Потом я в них запутываюсь, снова иду к врачу и говорю: «Я все перепутала». [Лидия Смирнова. Моя любовь (1997)] [омонимия не снята]
A15: 25.094675714148075 | B15: ьтяпо ыт кисуМ екйаЗ ьтипук | C15: алатупереп | D15: купить Зайке? ― Мусик, ты опять | E15: перепутала | F15: . | G15: У Ольги день рождения осенью | H15: Дарья Донцова. Доллары царя Гороха (2004) | I15: =IF(R[1]C[1]=RC[1],"",1) -> 1 | J15: Сергей Солоух | K15: 1959 | L15: Клуб одиноких сердец унтера Пришибеева | M15: 1991-1995 | N15: художественная | O15: роман | Q15: Сергей Солоух. Клуб одиноких сердец унтера Пришибеева | R15: 2002 | S15: книга | T15: омонимия не снята | U15: Перепутал время репетиции хора, точнее день, а именно, вторник со средой. [Сергей Солоух. Клуб одиноких сердец унтера Пришибеева (1991-1995)] [омонимия не снята]
A16: 29.438863210284115 | B16: но омидив он амод лыб | C16: латупереп | D16: был дома, но, видимо, он | E16: перепутал | G16: номер». | H16: Юлиан Семенов. Семнадцать мгновений весны (1968) | I16: =IF(R[1]C[1]=RC[1],"",1) -> 1 | J16: Алексей Варламов | K16: 1963 | L16: Падчевары | M16: 2002 | N16: художественная | O16: рассказ, цикл | Q16: «Новый Мир» | R16: 2002 | S16: журнал | T16: омонимия не снята | U16: Почти час искали ее по всему берегу, еще на что-то надеялись, казалось, вот-вот она появится, и мы просто перепутали кусты, я весь окрапивился, исцарапался и обсыпался листьями ― но надеяться было не на что и нечего искать. [Алексей Варламов. Падчевары // «Новый Мир», 2002] [омонимия не снята]
A17: 30.433412663833202 | B17: йыроток ярасип ьтинмопсВ | C17: латупереп | D17: Вспомнить писаря, который | E17: перепутал | G17: назначения: направил его в 22 | H17: Сергей Залыгин. Экологический роман // «Новый мир», 1993 | I17: =IF(R[1]C[1]=RC[1],"",1) -> 1 | J17: Наталья Александрова | L17: Последний ученик да Винчи | M17: 2010 | N17: художественная | O17: роман | Q17: Н. Н. Александрова. Последний ученик да Винчи | R17: 2010 | S17: книга | T17: омонимия не снята | U17: ― Наверное, вы перепутали меня с той ученой дамой за стойкой, ― насмешливо отозвалась девушка. [Наталья Александрова. Последний ученик да Винчи (2010)] [омонимия не снята]
A18: 33.515230540992668 | B18: ларван ьдубин-отч Я | C18: латупереп | D18: ― Я что-нибудь наврал, | E18: перепутал | F18: , | G18: например, факты, оклеветал кого-то? | H18: Ю. О. Домбровский. Обезьяна приходит за своим черепом. Пролог (1943-1958) | I18: =IF(R[1]C[1]=RC[1],"",1) -> 1 | J18: Борис Можаев | K18: 1923 | L18: Падение лесного короля | M18: 1975 | N18: художественная | O18: роман | Q18: Поединок. Выпуск 10 | R18: 1984 | S18: книга | T18: омонимия не снята | U18: Дело, которое он отобрал у тебя, освещается не с той стороны. Юридическое начало перепутал с хозяйственным. ― Давайте разберемся, кто что перепутал? [Борис Можаев. Падение лесного короля (1975)] [омонимия не снята]
A19: 33.73032587629541 | B19: ортем йеицнатс ос адоваз юундохорп | C19: латупереп | D19: проходную завода со станцией метро | E19: перепутал | F19: . | H19: А. В. Драбкина. Волшебные яблоки (1975) | I19: =IF(R[1]C[1]=RC[1],"",1) -> 1 | J19: Феликс Светов | K19: 1927 | L19: Чижик-пыжик | M19: 2001 | N19: художественная | O19: повесть | Q19: «Знамя» | R19: 2001 | S19: журнал | T19: омонимия не снята | U19: Я все перепутал, на самом деле, это я не ем по утрам, давно перестал, впрочем, с какого-то времени забывал и обедать, все равно вечером чем-то закусишь, так день и пройдет ― надоело, скучно. [Феликс Светов. Чижик-пыжик // «Знамя», 2001] [омонимия не снята]
A20: 33.974812189330784 | B20: от-отч ёом еинанзосдоП итсоннёровтелводуен ьлоб | C20: олатупереп | D20: боль неудовлетворённости. Подсознание моё что-то | E20: перепутало | F20: . | G20: Наслаждение красотой мира подавило боль | H20: Борис Неменский. Живая память // «Родина», 2008 | I20: =IF(R[1]C[1]=RC[1],"",1) -> 1 | J20: Ольга Ляпунова | L20: Отчет-лоция о путешествии в Крым | M20: 2002 | N20: бытовая , нехудожественная | O20: отчет | P20: путешествия | S20: электронный текст | T20: омонимия не снята | U20: В наши планы входило отплытие в Ласточкино гнездо на катерочке (они там ходят примерно раз в полтора часа), но начиналась самая жара, видимо мне напекло голову, что я перепутала время на час, катер ушел 10 минут назад, море немного штормило, а ветер был шквалистый. [Ольга Ляпунова. Отчет-лоция о путешествии в Крым (2002)] [омонимия не снята]
A21: 34.982211993682647 | B21: я ондивечо отч илазакс ытсилаицепс | C21: латупереп | D21: специалисты сказали, что, очевидно, я | E21: перепутал | F21: : | G21: с подобной надписью медали давались | H21: Даниил Гранин. Зубр (1987) | I21: =IF(R[1]C[1]=RC[1],"",1) -> 1 | J21: Борис Неменский | K21: 1922 | L21: Живая память | M21: 2008 | N21: публицистика , нехудожественная | O21: статья | P21: история, армия и вооруженные конфликты, искусство и культура | Q21: «Родина» | R21: 2008 | S21: журнал | T21: омонимия не снята | U21: Но нарастала боль неудовлетворённости. Подсознание моё что-то перепутало. Наслаждение красотой мира подавило боль, подавило всю многосложность проблемы. [Борис Неменский. Живая память // «Родина», 2008] [омонимия не снята]
A22: 36.074390131569359 | B22: отсорпан-отсорп ядолоВ еж маС | C22: латупереп | D22: Сам же Володя просто-напросто | E22: перепутал | G22: вгрызшихся в свои кресла морских | H22: Давид Карапетян. Владимир Высоцкий. Воспоминания (2000-2002) | I22: =IF(R[1]C[1]=RC[1],"",1) -> 1 | J22: Татьяна Соломатина | K22: 1971 | L22: Акушер-ХА! Байки | M22: 2009 | N22: художественная | O22: повесть | Q22: Татьяна Соломатина. Акушер-ХА! Байки | R22: 2010 | S22: книга | T22: омонимия не снята | U22: Он на столе препаратов просто наизнанку лежал. Вот Санёк малость и перепутал. Но и дольки и сосуды поджелудочной нашёл, что характерно. [Татьяна Соломатина. Акушер-ХА! Байки (2009)] [омонимия не снята]
A23: 36.960124756508861 | B23: ен юртомс уклыссар ил ут | C23: алатупереп | D23: ту ли рассылку смотрю, не | E23: перепутала | G23: ли :)))))) . | H23: коллективный. Форум: Гигиена души (2012) | I23: =IF(R[1]C[1]=RC[1],"",1) -> 1 | J23: В. А. Солоухин | K23: 1924 | L23: Капля росы | M23: 1959 | N23: художественная | O23: повесть | Q23: Солоухин В. А. Собр. соч.: В 5 т. Т.1 | R23: 2006 | S23: книга | T23: омонимия не снята | U23: Никакого «Щукина» или «Щукова» тоже возле Олепина нет, а перепутал это название писарь с «Шуновым». [В. А. Солоухин. Капля росы (1959)] [омонимия не снята]
A24: 39.24533677808553 | B24: отсорп ым и ястивяоп ано | C24: илатупереп | D24: она появится, и мы просто | E24: перепутали | G24: кусты, я весь окрапивился, исцарапался | H24: Алексей Варламов. Падчевары // «Новый Мир», 2002 | I24: =IF(R[1]C[1]=RC[1],"",1) -> 1 | J24: Ю. П. Анненков | K24: 1889 | L24: Дневник моих встреч | M24: 1966 | N24: публицистика , нехудожественная | O24: мемуары | Q24: Юрий Анненков. Дневник моих встреч | R24: 2001 | S24: книга | T24: омонимия не снята | U24: Правда, французский «arbouse» больше похож на землянику, но ведь слово-то уже существует, перепутали только значение. [Ю. П. Анненков. Дневник моих встреч (1966)] [омонимия не снята]
A25: 43.008734798085555 | B25: адгесван огеч елсоп модоран мищюундзарп | C25: алатупереп | D25: празднующим народом, после чего навсегда | E25: перепутала | G25: день с ночью. | H25: Катя Метелица. Солененькая моя, любименькая моя (1997) // «Столица», 1997.07.01 | I25: =IF(R[1]C[1]=RC[1],"",1) -> 1 | J25: Давид Карапетян | K25: 1939 | L25: Владимир Высоцкий. Воспоминания | M25: 2000-2002 | N25: публицистика , нехудожественная | O25: мемуары | Q25: Давид Карапетян. Владимир Высоцкий. Воспоминания | R25: 2002 | S25: книга | T25: омонимия не снята | U25: Сам же Володя просто-напросто перепутал вгрызшихся в свои кресла морских крыс с бороздящими океаны морскими волками… [Давид Карапетян. Владимир Высоцкий. Воспоминания (2000-2002)] [омонимия не снята]
A26: 49.950126444824036 | B26: я отч уволог олкепан енм | C26: алатупереп | D26: мне напекло голову, что я | E26: перепутала | G26: время на час, катер ушел | H26: Ольга Ляпунова. Отчет-лоция о путешествии в Крым (2002) | I26: =IF(R[1]C[1]=RC[1],"",1) -> 1 | L26: Собачья генетика | M26: 1997 | N26: публицистика , нехудожественная | O26: комментарий | P26: политика и общественная жизнь | Q26: «Столица» | R26: 1997.12.08 | S26: журнал | T26: омонимия не снята | U26: Выяснилось, что авторы ЖП ничего не перепутали. [Собачья генетика (1997) // «Столица», 1997.12.08] [омонимия не снята]

Sheet:  Сводка по авт."перепутать"
A3: Названия строк | B3: Количество по полю Количество
B4: 1
A5: А. В. Драбкина | B5: 1
A6: Александр Волков | B6: 2
A7: Александра Маринина | B7: 1
A8: Алексей Варламов | B8: 1
A9: Алексей Макушинский | B9: 1
A10: Алла Сурикова | B10: 1
A11: Анатолий Приставкин | B11: 1
A12: Андрей Геласимов | B12: 1
A13: Андрей Тарасов | B13: 1
A14: Б. Г. Бажанов | B14: 1
A15: Б. Л. Пастернак | B15: 1
A16: Борис Можаев | B16: 1
A17: Борис Неменский | B17: 1
A18: В. А. Солоухин | B18: 1
A19: В. В. Голявкин | B19: 1
A20: В. П. Дорофеев | B20: 1
A21: Владимир Высоцкий | B21: 1
A22: Галина Щербакова | B22: 1
A23: Давид Карапетян | B23: 1
A24: Даниил Гранин | B24: 1
A25: Дарья Донцова | B25: 1
A26: Дарья Симонова | B26: 1
A27: Егор Радов | B27: 1
A28: Елизавета Козырева | B28: 1
A29: Катя Метелица | B29: 1
A30: коллективный | B30: 2
A31: Лев Аннинский | B31: 1
A32: Лидия Смирнова | B32: 1
A33: Лион Измайлов | B33: 1
A34: Людмила Петрушевская | B34: 1
A35: Марина Вишневецкая | B35: 1
A36: Наталья Александрова | B36: 1
A37: Ольга Ляпунова | B37: 1
A38: Ольга Мачнева | B38: 1
A39: С. Л. Рябцева | B39: 1
A40: Сергей Залыгин | B40: 1
A41: Сергей Носов | B41: 1
A42: Сергей Солоух | B42: 1
A43: Татьяна Соломатина | B43: 1
A44: Феликс Светов | B44: 1
A45: Фридрих Горенштейн | B45: 1
A46: Эдвард Радзинский | B46: 1
A47: Эльдар Рязанов, Эмиль Брагинский | B47: 1
A48: Ю. О. Домбровский | B48: 1
A49: Ю. П. Анненков | B49: 1
A50: Юлиан Семенов | B50: 1
A51: Юрий Дружков (Постников) | B51: 1
A52: (пусто)
A53: Общий итог | B53: 50

Sheet: Итоговая
A1: 29.626467814069144 | B1: Reversed left context | C1: Reversed center | D1: Left context | E1: Center | F1: Punct | G1: Right context | H1: Title | I1: Количество | J1: Author | K1: Birthday | L1: Header | M1: Created | N1: Sphere | O1: Type | P1: Topic | Q1: Publication | R1: Publ_year | S1: Medium | T1: Ambiguity | U1: PREFIX | V1: TENSE | W1: PERSONNUMBER | X1: PARTICIPANT1 | Y1: PARTICIPANT2 | Z1: PARTICIPANT3 | AA1: Full context
A2: 1.6978292082347801 | B2: есв кичьлаМ ьнед нидо в | C2: театупереп | D2: в один день! Мальчик все | E2: перепутает | F2: ! | G2: ― Вот-вот, ― обиделся учитель. | H2: Юрий Дружков (Постников). Приключения Карандаша и Самоделкина (1964) | I2: =IF(R[1]C[1]=RC[1],"",1) -> 1 | J2: Ольга Мачнева | L2: Чем моложе препод, тем он коварнее | M2: 2003 | N2: публицистика , нехудожественная | O2: статья | P2: политика и общественная жизнь | Q2: «Вечерняя Казань» | R2: 2003.01.05 | S2: газета | T2: омонимия не снята | U2: пере | V2: прош. | W2: неопр.л.ед.ч. | X2: Лицо | Y2: Абстрактный объект | Z2: Абстрактный объект | AA2: Пришла тут ко мне одна девушка на экзамен и перепутала «вольты» с «мегапаскалями», а «глухую заделку» ― с «заземлением». [Ольга Мачнева. Чем моложе препод, тем он коварнее (2003) // «Вечерняя Казань», 2003.01.05] [омонимия не снята]
A3: 9.8660655666498513 | B3: яслялвяоп ен чиволйахиМ нотнА | C3: латупереП | D3: Антон Михайлович не появлялся. ― | E3: Перепутал | G3: вагон, что ли! ― в сердцах | H3: Эльдар Рязанов, Эмиль Брагинский. Тихие омуты (1998) | I3: =IF(R[1]C[1]=RC[1],"",1) -> 1 | J3: Александра Маринина | K3: 1957 | L3: За все надо платить | M3: 1995 | N3: художественная | O3: роман | Q3: Александра Маринина. За все надо платить | R3: 2006 | S3: книга | T3: омонимия не снята | U3: пере | V3: прош. | W3: неопр.л.ед.ч. | X3: Лицо | Y3: Абстрактный объект | Z3: NA | AA3: Идиотка, она что-то забыла, что-то не так запомнила, перепутала какое-то название! [Александра Маринина. За все надо платить (1995)] [омонимия не снята]
A4: 18.008441677349296 | C4: латупереП | E4: Перепутал | G4: команды, понял как команду на | H4: Андрей Тарасов. С пистолетом на борту // «Знание - сила», 2011 | I4: =IF(R[1]C[1]=RC[1],"",1) -> 1 | J4: Эдвард Радзинский | K4: 1936 | L4: Наш Декамерон | M4: 1980-1990 | N4: художественная | O4: роман | Q4: Радзинский Э. Собрание сочинений: В 7 т. Т.3 | R4: 1998 | S4: книга | T4: омонимия не снята | U4: пере | V4: прош. | W4: неопр.л.ед.ч. | X4: Лицо | Y4: Неодуш.конкрет.объект | Z4: NA | AA4: ― Что случилось? ― Перепутал портфели, ― злобно сказал З. ― И конечно, в портфеле что-то было! [Эдвард Радзинский. Наш Декамерон (1980-1990)] [омонимия не снята]
A5: 20.201799861904522 | B5: ьсоличулс отЧ | C5: латупереП | D5: ― Что случилось? ― | E5: Перепутал | G5: портфели, ― злобно сказал З. ― И | H5: Эдвард Радзинский. Наш Декамерон (1980-1990) | I5: =IF(R[1]C[1]=RC[1],"",1) -> 1 | J5: коллективный | L5: Форум: Гигиена души | M5: 2012 | N5: электронная коммуникация, нехудожественная | O5: форум, блог | P5: психология | S5: электронный текст | T5: омонимия не снята | U5: пере | V5: прош. | W5: неопр.л.ед.ч. | X5: Лицо | Y5: NA | Z5: NA | AA5: [ДаКар, жен] Я даже перепроверила, ту ли рассылку смотрю, не перепутала ли :)))))) . [коллективный. Форум: Гигиена души (2012)] [омонимия не снята]
A6: 22.523453742581356 | B6: набруК илА ондиВ | C6: латупереП | D6: Видно, Али Курбан. | E6: Перепутал | G6: ты. ― Може, и Курбан. | H6: Б. Л. Пастернак. Доктор Живаго (1945-1955) | I6: =IF(R[1]C[1]=RC[1],"",1) -> 1 | J6: Дарья Симонова | K6: 1972 | L6: Половецкие пляски | M6: 2002 | N6: художественная | O6: повесть | Q6: Дарья Симонова. Половецкие пляски | R6: 2002 | S6: книга | T6: омонимия не снята | U6: пере | V6: прош. | W6: неопр.л.ед.ч. | X6: Лицо | Y6: Неодуш.конкрет.объект | Z6: NA | AA6: Но однажды Половецкая оконфузилась и после шестой банки перепутала одежки ― две кожаные куртки рядом, немудрено, ― залезла в карман к серьезному человеку, с суровым именем Макар, бывшему в этом доме персоной грата на все случаи жизни. [Дарья Симонова. Половецкие пляски (2002)] [омонимия не снята]
A7: 24.464964311544101 | B7: ен откин ее ьрепеТ | C7: латупереп | D7: Теперь ее никто не | E7: перепутал | G7: бы со студенткой, в лице | H7: Елизавета Козырева. Дамская охота (2001) | I7: =IF(R[1]C[1]=RC[1],"",1) -> 1 | J7: Елизавета Козырева | L7: Дамская охота | M7: 2001 | N7: художественная | O7: роман | Q7: Елизавета Козырева. Дамская охота | R7: 2001 | S7: книга | T7: омонимия не снята | U7: пере | V7: прош. | W7: неопр.л.ед.ч. | X7: Лицо | Y7: Лицо | Z7: Лицо | AA7: Теперь ее никто не перепутал бы со студенткой, в лице ― ничего юного и беззащитного. [Елизавета Козырева. Дамская охота (2001)] [омонимия не снята]
A8: 25.074079999460295 | B8: гом еогонм лыбаз утсорпоп вокненнА | C8: латупереп | D8: Анненков попросту забыл, многое мог | E8: перепутал | G8: за давностью лет, но несомненно | H8: В. П. Дорофеев. П. В. Анненков и его воспоминания. Вступительная статья (1960) | I8: =IF(R[1]C[1]=RC[1],"",1) -> 1 | J8: Лидия Смирнова | K8: 1913 | L8: Моя любовь | M8: 1997 | N8: публицистика , нехудожественная | O8: мемуары | Q8: Лидия Смирнова. Моя любовь | R8: 1997 | S8: книга | T8: омонимия не снята | U8: пере | V8: прош. | W8: неопр.л.ед.ч. | X8: Лицо | Y8: Абстрактный объект | Z8: NA | AA8: Потом я в них запутываюсь, снова иду к врачу и говорю: «Я все перепутала». [Лидия Смирнова. Моя любовь (1997)] [омонимия не снята]
A9: 29.438863210284115 | B9: но омидив он амод лыб | C9: латупереп | D9: был дома, но, видимо, он | E9: перепутал | G9: номер». | H9: Юлиан Семенов. Семнадцать мгновений весны (1968) | I9: =IF(R[1]C[1]=RC[1],"",1) -> 1 | J9: Алексей Варламов | K9: 1963 | L9: Падчевары | M9: 2002 | N9: художественная | O9: рассказ, цикл | Q9: «Новый Мир» | R9: 2002 | S9: журнал | T9: омонимия не снята | U9: пере | V9: прош. | W9: неопр.л.мн.ч. | X9: Лицо | Y9: Неодуш.конкрет.объект | Z9: NA | AA9: Почти час искали ее по всему берегу, еще на что-то надеялись, казалось, вот-вот она появится, и мы просто перепутали кусты, я весь окрапивился, исцарапался и обсыпался листьями ― но надеяться было не на что и нечего искать. [Алексей Варламов. Падчевары // «Новый Мир», 2002] [омонимия не снята]
A10: 30.433412663833202 | B10: йыроток ярасип ьтинмопсВ | C10: латупереп | D10: Вспомнить писаря, который | E10: перепутал | G10: назначения: направил его в 22 | H10: Сергей Залыгин. Экологический роман // «Новый мир», 1993 | I10: =IF(R[1]C[1]=RC[1],"",1) -> 1 | J10: Наталья Александрова | L10: Последний ученик да Винчи | M10: 2010 | N10: художественная | O10: роман | Q10: Н. Н. Александрова. Последний ученик да Винчи | R10: 2010 | S10: книга | T10: омонимия не снята | U10: пере | V10: прош. | W10: неопр.л.мн.ч. | X10: Лицо | Y10: Лицо | Z10: Лицо | AA10: ― Наверное, вы перепутали меня с той ученой дамой за стойкой, ― насмешливо отозвалась девушка. [Наталья Александрова. Последний ученик да Винчи (2010)] [омонимия не снята]
A11: 33.515230540992668 | B11: ларван ьдубин-отч Я | C11: латупереп | D11: ― Я что-нибудь наврал, | E11: перепутал | F11: , | G11: например, факты, оклеветал кого-то? | H11: Ю. О. Домбровский. Обезьяна приходит за своим черепом. Пролог (1943-1958) | I11: =IF(R[1]C[1]=RC[1],"",1) -> 1 | J11: Борис Можаев | K11: 1923 | L11: Падение лесного короля | M11: 1975 | N11: художественная | O11: роман | Q11: Поединок. Выпуск 10 | R11: 1984 | S11: книга | T11: омонимия не снята | U11: пере | V11: прош. | W11: неопр.л.ед.ч. | X11: NA | Y11: Абстрактный объект | Z11: NA | AA11: Дело, которое он отобрал у тебя, освещается не с той стороны. Юридическое начало перепутал с хозяйственным. ― Давайте разберемся, кто что перепутал? [Борис Можаев. Падение лесного короля (1975)] [омонимия не снята]
A12: 33.73032587629541 | B12: ортем йеицнатс ос адоваз юундохорп | C12: латупереп | D12: проходную завода со станцией метро | E12: перепутал | F12: . | H12: А. В. Драбкина. Волшебные яблоки (1975) | I12: =IF(R[1]C[1]=RC[1],"",1) -> 1 | J12: Феликс Светов | K12: 1927 | L12: Чижик-пыжик | M12: 2001 | N12: художественная | O12: повесть | Q12: «Знамя» | R12: 2001 | S12: журнал | T12: омонимия не снята | U12: пере | V12: прош. | W12: неопр.л.ед.ч. | X12: Лицо | Y12: Абстрактный объект | Z12: NA | AA12: Я все перепутал, на самом деле, это я не ем по утрам, давно перестал, впрочем, с какого-то времени забывал и обедать, все равно вечером чем-то закусишь, так день и пройдет ― надоело, скучно. [Феликс Светов. Чижик-пыжик // «Знамя», 2001] [омонимия не снята]
A13: 34.982211993682647 | B13: я ондивечо отч илазакс ытсилаицепс | C13: латупереп | D13: специалисты сказали, что, очевидно, я | E13: перепутал | F13: : | G13: с подобной надписью медали давались | H13: Даниил Гранин. Зубр (1987) | I13: =IF(R[1]C[1]=RC[1],"",1) -> 1 | J13: Борис Неменский | K13: 1922 | L13: Живая память | M13: 2008 | N13: публицистика , нехудожественная | O13: статья | P13: история, армия и вооруженные конфликты, искусство и культура | Q13: «Родина» | R13: 2008 | S13: журнал | T13: омонимия не снята | U13: пере | V13: прош. | W13: неопр.л.ед.ч. | X13: Абстрактный объект | Y13: Абстрактный объект | Z13: NA | AA13: Но нарастала боль неудовлетворённости. Подсознание моё что-то перепутало. Наслаждение красотой мира подавило боль, подавило всю многосложность проблемы. [Борис Неменский. Живая память // «Родина», 2008] [омонимия не снята]
A14: 36.074390131569359 | B14: отсорпан-отсорп ядолоВ еж маС | C14: латупереп | D14: Сам же Володя просто-напросто | E14: перепутал | G14: вгрызшихся в свои кресла морских | H14: Давид Карапетян. Владимир Высоцкий. Воспоминания (2000-2002) | I14: =IF(R[1]C[1]=RC[1],"",1) -> 1 | J14: Татьяна Соломатина | K14: 1971 | L14: Акушер-ХА! Байки | M14: 2009 | N14: художественная | O14: повесть | Q14: Татьяна Соломатина. Акушер-ХА! Байки | R14: 2010 | S14: книга | T14: омонимия не снята | U14: пере | V14: прош. | W14: неопр.л.ед.ч. | X14: Лицо | Y14: NA | Z14: NA | AA14: Он на столе препаратов просто наизнанку лежал. Вот Санёк малость и перепутал. Но и дольки и сосуды поджелудочной нашёл, что характерно. [Татьяна Соломатина. Акушер-ХА! Байки (2009)] [омонимия не снята]
A15: 15.731175774435179 | B15: я отэ тежоМ тнатьлуснок как | C15: алатупереп | D15: как консультант. Может, это я | E15: перепутала | F15: . | G15: СЫН. | H15: Людмила Петрушевская. Свидание (1997) | I15: =IF(R[1]C[1]=RC[1],"",1) -> 1 | J15: Даниил Гранин | K15: 1919 | L15: Зубр | M15: 1987 | N15: художественная | O15: повесть | Q15: Гранин Д.А. Зубр: Повесть | R15: 1987 | S15: книга | T15: омонимия снята | U15: пере | V15: прош. | W15: неопр.л.ед.ч. | X15: Лицо | Y15: NA | Z15: NA | AA15: Сперва специалисты сказали, что, очевидно, я перепутал: с подобной надписью медали давались сразу после победы участникам кампании 1812 года, серебряные и бронзовые. [Даниил Гранин. Зубр (1987)] [омонимия снята]
A16: 23.03828745493497 | B16: енс ов теавыб как ьтыб | C16: алатупереп | D16: быть, как бывает во сне, | E16: перепутала | G16: время и, придя уже после | H16: Марина Вишневецкая. Вышел месяц из тумана (1997) | I16: =IF(R[1]C[1]=RC[1],"",1) -> 1 | J16: Анатолий Приставкин | K16: 1931 | L16: Вагончик мой дальний | M16: 2005 | N16: художественная | O16: повесть | Q16: «Октябрь» | R16: 2005 | S16: книга | T16: омонимия не снята | U16: пере | V16: буд. | W16: 2л.ед.ч. | X16: Лицо | Y16: NA | Z16: NA | AA16: ― Отнесу, ― натянуто произнес он. ― Не перепутаешь? Костик замолчал. [Анатолий Приставкин. Вагончик мой дальний (2005)] [омонимия не снята]
A17: 25.094675714148075 | B17: ьтяпо ыт кисуМ екйаЗ ьтипук | C17: алатупереп | D17: купить Зайке? ― Мусик, ты опять | E17: перепутала | F17: . | G17: У Ольги день рождения осенью | H17: Дарья Донцова. Доллары царя Гороха (2004) | I17: =IF(R[1]C[1]=RC[1],"",1) -> 1 | J17: Сергей Солоух | K17: 1959 | L17: Клуб одиноких сердец унтера Пришибеева | M17: 1991-1995 | N17: художественная | O17: роман | Q17: Сергей Солоух. Клуб одиноких сердец унтера Пришибеева | R17: 2002 | S17: книга | T17: омонимия не снята | U17: пере | V17: прош. | W17: неопр.л.ед.ч. | X17: NA | Y17: Абстрактный объект | Z17: Абстрактный объект | AA17: Перепутал время репетиции хора, точнее день, а именно, вторник со средой. [Сергей Солоух. Клуб одиноких сердец унтера Пришибеева (1991-1995)] [омонимия не снята]
A18: 36.960124756508861 | B18: ен юртомс уклыссар ил ут | C18: алатупереп | D18: ту ли рассылку смотрю, не | E18: перепутала | G18: ли :)))))) . | H18: коллективный. Форум: Гигиена души (2012) | I18: =IF(R[1]C[1]=RC[1],"",1) -> 1 | J18: В. А. Солоухин | K18: 1924 | L18: Капля росы | M18: 1959 | N18: художественная | O18: повесть | Q18: Солоухин В. А. Собр. соч.: В 5 т. Т.1 | R18: 2006 | S18: книга | T18: омонимия не снята | U18: пере | V18: прош. | W18: неопр.л.ед.ч. | X18: Лицо | Y18: Абстрактный объект | Z18: Абстрактный объект | AA18: Никакого «Щукина» или «Щукова» тоже возле Олепина нет, а перепутал это название писарь с «Шуновым». [В. А. Солоухин. Капля росы (1959)] [омонимия не снята]
A19: 43.008734798085555 | B19: адгесван огеч елсоп модоран мищюундзарп | C19: алатупереп | D19: празднующим народом, после чего навсегда | E19: перепутала | G19: день с ночью. | H19: Катя Метелица. Солененькая моя, любименькая моя (1997) // «Столица», 1997.07.01 | I19: =IF(R[1]C[1]=RC[1],"",1) -> 1 | J19: Давид Карапетян | K19: 1939 | L19: Владимир Высоцкий. Воспоминания | M19: 2000-2002 | N19: публицистика , нехудожественная | O19: мемуары | Q19: Давид Карапетян. Владимир Высоцкий. Воспоминания | R19: 2002 | S19: книга | T19: омонимия не снята | U19: пере | V19: прош. | W19: неопр.л.ед.ч. | X19: Лицо | Y19: Животное | Z19: Животное | AA19: Сам же Володя просто-напросто перепутал вгрызшихся в свои кресла морских крыс с бороздящими океаны морскими волками… [Давид Карапетян. Владимир Высоцкий. Воспоминания (2000-2002)] [омонимия не снята]
A20: 49.950126444824036 | B20: я отч уволог олкепан енм | C20: алатупереп | D20: мне напекло голову, что я | E20: перепутала | G20: время на час, катер ушел | H20: Ольга Ляпунова. Отчет-лоция о путешествии в Крым (2002) | I20: =IF(R[1]C[1]=RC[1],"",1) -> 1 | L20: Собачья генетика | M20: 1997 | N20: публицистика , нехудожественная | O20: комментарий | P20: политика и общественная жизнь | Q20: «Столица» | R20: 1997.12.08 | S20: журнал | T20: омонимия не снята | U20: пере | V20: прош. | W20: неопр.л.мн.ч. | X20: Лицо | Y20: Абстрактный объект | Z20: NA | AA20: Выяснилось, что авторы ЖП ничего не перепутали. [Собачья генетика (1997) // «Столица», 1997.12.08] [омонимия не снята]
A21: 3.6608122718600811 | B21: ен юровог ыВ | C21: илатупереп | D21: Вы, говорю, не | E21: перепутали | F21: , | G21: что значит быть племянником и | H21: Галина Щербакова. Loveстория (1996) | I21: =IF(R[1]C[1]=RC[1],"",1) -> 1 | J21: Сергей Носов | K21: 1957 | L21: Фигурные скобки | M21: 2015 | N21: художественная | O21: роман | Q21: С. А. Носов. Фигурные скобки | R21: 2015 | S21: книга | T21: омонимия не снята | U21: пере | V21: прош. | W21: неопр.л.ед.ч. | X21: Лицо | Y21: Абстрактный объект | Z21: NA | AA21: — Евгений Геннадьевич, это я с вами вчера говорила, это я вам заказала на адлерский поезд, а наши все перепутали, послали машину не туда, на Московский вокзал, вы простите, но мы вас уже не успеем встретить… сможете без нас? [Сергей Носов. Фигурные скобки (2015)] [омонимия не снята]
A22: 13.302166964573935 | B22: ыв еонреваН | C22: илатупереп | D22: ― Наверное, вы | E22: перепутали | G22: меня с той ученой дамой | H22: Наталья Александрова. Последний ученик да Винчи (2010) | I22: =IF(R[1]C[1]=RC[1],"",1) -> 1 | J22: В. В. Голявкин | K22: 1929 | L22: Веселые ребята | M22: 1973 | N22: художественная | O22: рассказ | Q22: Виктор Голявкин. «Большие скорости». Роман, рассказы | R22: 1988 | S22: книга | T22: омонимия не снята | U22: пере | V22: прош. | W22: неопр.л.ед.ч. | X22: Лицо | Y22: NA | Z22: NA | AA22: Звоню в телевизионное ателье на другой день, спрашиваю техника, интересуюсь, почему он вчера не пришел, а он мне весело отвечает, что перепутал мой адрес. ― А вы больше не перепутаете? ― спрашиваю. [В. В. Голявкин. Веселые ребята (1973)] [омонимия не снята]
A23: 13.649365645873978 | B23: ёсв есв отч ьсолинсяыв гурдв | C23: илатупереп | D23: вдруг выяснилось, что все всё | E23: перепутали | F23: , | G23: то ли Света все перепутала | H23: Алексей Макушинский. Город в долине (2012) | I23: =IF(R[1]C[1]=RC[1],"",1) -> 1 | J23: С. Л. Рябцева | L23: Дети восьмидесятых | M23: 1989 | N23: публицистика, нехудожественная | O23: монография | P23: образование | Q23: С. Л. Рябцева. Дети восьмидесятых | R23: 1989 | S23: книга | T23: омонимия не снята | U23: пере | V23: прош. | W23: неопр.л.ед.ч. | X23: NA | Y23: NA | Z23: NA | AA23: Молча показываю нелепицу ― ахают, удивляются: ― Как же так… ― Перепутал… ― Забыл… Крепко нас избили. [С. Л. Рябцева. Дети восьмидесятых (1989)] [омонимия не снята]
A24: 39.24533677808553 | B24: отсорп ым и ястивяоп ано | C24: илатупереп | D24: она появится, и мы просто | E24: перепутали | G24: кусты, я весь окрапивился, исцарапался | H24: Алексей Варламов. Падчевары // «Новый Мир», 2002 | I24: =IF(R[1]C[1]=RC[1],"",1) -> 1 | J24: Ю. П. Анненков | K24: 1889 | L24: Дневник моих встреч | M24: 1966 | N24: публицистика , нехудожественная | O24: мемуары | Q24: Юрий Анненков. Дневник моих встреч | R24: 2001 | S24: книга | T24: омонимия не снята | U24: пере | V24: прош. | W24: неопр.л.мн.ч. | X24: NA | Y24: Абстрактный объект | Z24: NA | AA24: Правда, французский «arbouse» больше похож на землянику, но ведь слово-то уже существует, перепутали только значение. [Ю. П. Анненков. Дневник моих встреч (1966)] [омонимия не снята]
A25: 33.974812189330784 | B25: от-отч ёом еинанзосдоП итсоннёровтелводуен ьлоб | C25: олатупереп | D25: боль неудовлетворённости. Подсознание моё что-то | E25: перепутало | F25: . | G25: Наслаждение красотой мира подавило боль | H25: Борис Неменский. Живая память // «Родина», 2008 | I25: =IF(R[1]C[1]=RC[1],"",1) -> 1 | J25: Ольга Ляпунова | L25: Отчет-лоция о путешествии в Крым | M25: 2002 | N25: бытовая , нехудожественная | O25: отчет | P25: путешествия | S25: электронный текст | T25: омонимия не снята | U25: пере | V25: прош. | W25: неопр.л.ед.ч. | X25: Лицо | Y25: Абстрактный объект | Z25: NA | AA25: В наши планы входило отплытие в Ласточкино гнездо на катерочке (они там ходят примерно раз в полтора часа), но начиналась самая жара, видимо мне напекло голову, что я перепутала время на час, катер ушел 10 минут назад, море немного штормило, а ветер был шквалистый. [Ольга Ляпунова. Отчет-лоция о путешествии в Крым (2002)] [омонимия не снята]
A26: 9.6592258865765288 | B26: ен адгокин исуг ьрепеТ | C26: тюатупереп | D26: Теперь гуси никогда не | E26: перепутают | G26: других людей со своими воспитателями | H26: Александр Волков. Рассказы о животных, и не только о них: Чудесное путешествие Кристиана с дикими гусями // «Знание ― сила», 2003 | I26: =IF(R[1]C[1]=RC[1],"",1) -> 1 | J26: Эльдар Рязанов, Эмиль Брагинский | K26: 1927, 1921 | L26: Тихие омуты | M26: 1998 | N26: художественная | O26: киноповесть | Q26: Эльдар Рязанов, Эмиль Брагинский. Тихие омуты | R26: 1999 | S26: книга | T26: омонимия не снята | U26: пере | V26: прош. | W26: неопр.л.ед.ч. | X26: Лицо | Y26: Неодуш.конкрет.объект | Z26: NA | AA26: Антон Михайлович не появлялся. ― Перепутал вагон, что ли! ― в сердцах воскликнула Полина Сергеевна, обращаясь к проводнице. [Эльдар Рязанов, Эмиль Брагинский. Тихие омуты (1998)] [омонимия не снята]
A27: 15.268988704981879 | B27: ен мигурд микак с ин | C27: ьшеатупс | D27: ни с каким другим не | E27: спутаешь | F27: . | H27: Г. В. Адамович. Борис Зайцев (1955) | I27: 1 | J27: Г. В. Адамович | K27: 1892 | L27: Борис Зайцев | M27: 1955 | N27: публицистика , нехудожественная | O27: статья | P27: искусство и культура , филология , культурология | Q27: Адамович Г. В. Одиночество и свобода | R27: 2002 | S27: книга | T27: омонимия не снята | U27: с | V27: буд. | W27: 2л.ед.ч. | X27: NA | Y27: Абстрактный объект | Z27: Абстрактный объект | AA27: Он полностью был самим собой, голос его ни с каким другим не спутаешь. [Г. В. Адамович. Борис Зайцев (1955)] [омонимия не снята]
A28: 18.430010130936648 | B28: ен йеьч с ин укчур | C28: ьшеатупс | D28: ручку ни с чьей не | E28: спутаешь | F28: . | H28: Дина Сабитова. Где нет зимы (2011) | I28: 1 | J28: Дина Сабитова | K28: 1969 | L28: Где нет зимы | M28: 2011 | N28: художественная | O28: повесть | Q28: Д. Р. Сабитова. Цирк в шкатулке | R28: 2007 | S28: книга | T28: омонимия не снята | U28: с | V28: буд. | W28: 2л.ед.ч. | X28: NA | Y28: Неодуш.конкрет.объект | Z28: Неодуш.конкрет.объект | AA28: Такую ручку ни с чьей не спутаешь. [Дина Сабитова. Где нет зимы (2011)] [омонимия не снята]
A29: 36.729611666108816 | B29: ен ценок и уничнок оН | C29: ьшеатупс | D29: Но кончину и конец не | E29: спутаешь | F29: . | G29: Правда, не у каждого. | H29: Галина Шергова. …Об известных всем (2002-2004) | I29: 1 | J29: Галина Шергова | K29: 1923 | L29: …Об известных всем | M29: 2002-2004 | N29: публицистика , нехудожественная | O29: мемуары | Q29: Г. Шергова. …Об известных всем | R29: 2004 | S29: книга | T29: омонимия не снята | U29: с | V29: буд. | W29: 2л.ед.ч. | X29: NA | Y29: Абстрактный объект | Z29: NA | AA29: Как горько, что задумываемся мы сплошь и рядом уже после чьей-то кончины. Но кончину и конец не спутаешь. Правда, не у каждого. [Галина Шергова. …Об известных всем (2002-2004)] [омонимия не снята]
A30: 40.535909228608716 | B30: ен хи ишаН икноров юатичс | C30: ьшеатупс | D30: считаю воронки. Наши, их не | E30: спутаешь | F30: . | G30: Несколько прямых попаданий в окоп | H30: Г. Я. Бакланов. Пядь земли (1959) | I30: 1 | J30: Г. Я. Бакланов | K30: 1923 | L30: Пядь земли | M30: 1959 | N30: художественная | O30: повесть | Q30: Григорий Яковлевич Бакланов. Пядь земли. Повести. Роман. Рассказы | R30: 1983 | S30: книга | T30: омонимия не снята | U30: с | V30: буд. | W30: 2л.ед.ч. | X30: NA | Y30: Лицо | Z30: NA | AA30: Я с удовольствием хожу по брошенным орудийным окопам, считаю воронки. Наши, их не спутаешь. Несколько прямых попаданий в окоп. [Г. Я. Бакланов. Пядь земли (1959)] [омонимия не снята]
A31: 3.9671406375649809 | B31: мюаФ ларизерп ен ьсядорто я | C31: латупс | D31: я отродясь не презирал ― Фаюм | E31: спутал | G31: с «вольным стихом», с верлибром | H31: Юлий Даниэль. Письма из заключения (1966-1970) | I31: 1 | J31: Юлий Даниэль | K31: 1925 | L31: Письма из заключения | M31: 1966-1970 | N31: бытовая , нехудожественная | O31: письмо личное | P31: частная жизнь | Q31: Юлий Даниэль. «Я всё сбиваюсь на литературу…» Письма из заключения. Стихи | R31: 2000 | S31: книга | T31: омонимия не снята | U31: с | V31: прош. | W31: неопр.л.ед.ч. | X31: Лицо | Y31: NA | Z31: Абстрактный объект | AA31: А белый стих я отродясь не презирал ― Фаюм спутал с «вольным стихом», с верлибром. [Юлий Даниэль. Письма из заключения (1966-1970)] [омонимия не снята]
A32: 13.956316046081518 | B32: еН ыппург ьлетидовокур ьдев ыт | C32: латупс | D32: ты ведь руководитель группы? Не | E32: спутал | F32: ?» | G32: «Я главный архитектор проекта», ― ответил | H32: Анатолий Найман. Все и каждый // «Октябрь», 2003 | I32: 1 | J32: Анатолий Найман | K32: 1936 | L32: Все и каждый | M32: 2003 | N32: художественная | O32: роман | Q32: «Октябрь» | R32: 2003 | S32: журнал | T32: омонимия не снята | U32: с | V32: прош. | W32: неопр.л.ед.ч. | X32: Лицо | Y32: NA | Z32: NA | AA32: Я правильно говорю ― ты ведь руководитель группы? Не спутал?» «Я главный архитектор проекта», ― ответил Андрей и подумал, что ничего тот не путал, а сказал, что собирался сказать. [Анатолий Найман. Все и каждый // «Октябрь», 2003] [омонимия не снята]
A33: 15.562347211345129 | B33: Я еталпыв хи бо яинешер | C33: латупс | D33: решения об их выплате. Я | E33: спутал | G33: Челябинск и Свердловск. Челябинска у | H33: коллективный. Форум: Энергосбыты (2008) | I33: 1 | J33: коллективный | L33: Форум: Энергосбыты | M33: 2008 | N33: электронная коммуникация , нехудожественная | O33: форум | P33: бизнес, коммерция, экономика, финансы | R33: 2008 | S33: электронный текст | T33: омонимия не снята | U33: с | V33: прош. | W33: неопр.л.ед.ч. | X33: Лицо | Y33: Место | Z33: Место | AA33: [poter, nick] 2. Выплатить дивиденды по привилегированным акциям Общества по результатам 2009 года в размер 0, 004564 рублей на одну обыкновенную акцию Общества в денежной форме в течение 60 дней со дня принятия решения об их выплате. Я спутал Челябинск и Свердловск. Челябинска у меня нет. [коллективный. Форум: Энергосбыты (2008)] [омонимия не снята]
A34: 19.558455720756342 | B34: ьджоД | C34: латупс | D34: Дождь | E34: спутал | G34: планы премьера Касьянов полюбил новосибирский | H34: Елена Лашкина. Дождь спутал планы премьера (2003) // «Российская газета», 2003.04.03 | I34: 1 | J34: Елена Лашкина | L34: Дождь спутал планы премьера | M34: 2003 | N34: публицистика , нехудожественная | O34: статья | P34: политика и общественная жизнь | Q34: «Российская газета» | R34: 2003.04.03 | S34: газета | T34: омонимия не снята | U34: с | V34: прош. | W34: неопр.л.ед.ч. | X34: Неодуш.конкрет.объект | Y34: Абстрактный объект | Z34: Абстрактный объект | AA34: Дождь спутал планы премьера Касьянов полюбил новосибирский хлеб и поругал московских силовиков [Елена Лашкина. Дождь спутал планы премьера (2003) // «Российская газета», 2003.04.03] [омонимия не снята]
A35: 20.384010692843702 | B35: ябет я тичанЗ ьсолаврыв оген | C35: латупс | D35: него вырвалось: «Значит, я тебя | E35: спутал | G35: с другой». | H35: Владимир Шахиджанян. 1001 вопрос про ЭТО (№№ 501-1001) (1999) | I35: 1 | J35: Владимир Шахиджанян | K35: 1940 | L35: 1001 вопрос про ЭТО (№№ 501-1001) | M35: 1999 | N35: учебно-научная , нехудожественная | O35: учебное пособие | P35: здоровье и медицина | Q35: 1001 вопрос про ЭТО | R35: 1999 | S35: книга | T35: омонимия не снята | U35: с | V35: прош. | W35: неопр.л.ед.ч. | X35: Лицо | Y35: Лицо | Z35: Лицо | AA35: А у него вырвалось: «Значит, я тебя спутал с другой». [Владимир Шахиджанян. 1001 вопрос про ЭТО (№№ 501-1001) (1999)] [омонимия не снята]
A36: 23.148603104953224 | B36: отч йокбишо йолам йот С | C36: латупс | D36: С той малой ошибкой, что | E36: спутал | G36: шофёра с ездоком, вещий старик | H36: А. И. Солженицын. Архипелаг ГУЛаг (1958-1973) | I36: 1 | J36: А. И. Солженицын | K36: 1918 | L36: Архипелаг ГУЛаг | M36: 1958-1973 | N36: публицистика , нехудожественная | O36: монография | P36: политика и общественная жизнь | S36: книга | T36: омонимия не снята | U36: с | V36: прош. | W36: неопр.л.ед.ч. | X36: Лицо | Y36: Лицо | Z36: Лицо | AA36: 23 С той малой ошибкой, что спутал шофёра с ездоком, вещий старик почти ведь и не ошибся! [А. И. Солженицын. Архипелаг ГУЛаг (1958-1973)] [омонимия не снята]
A37: 34.188683561063208 | B37: акнакирема ьтыб тежоМ | C37: латупс | D37: ― Может быть, американка | E37: спутал | F37: , ― | G37: сказал Ершов и стал драть | H37: Василий Гроссман. Жизнь и судьба, ч. 1 (1960) | I37: 1 | J37: Василий Гроссман | K37: 1905 | L37: Жизнь и судьба, ч. 1 | M37: 1960 | N37: художественная | O37: роман | Q37: Гроссман В. Жизнь и судьба | R37: 1992 | S37: книга | T37: омонимия снята | U37: с | V37: прош. | W37: неопр.л.ед.ч. | X37: Лицо | Y37: NA | Z37: NA | AA37: ― Может быть, американка спутал, ― сказал Ершов и стал драть ногтями грудь. ― Может быть, наоборот, Коминтерн расширяется. [Василий Гроссман. Жизнь и судьба, ч. 1 (1960)] [омонимия снята]
A38: 39.520801251108828 | B38: есв я ьтыб тежоМ | C38: латупс | D38: Может быть, я все | E38: спутал | G38: и это было не с | H38: Виктор Розов. Удивление перед жизнью (1960-2000) | I38: 1 | J38: Виктор Розов | K38: 1913 | L38: Удивление перед жизнью | M38: 1960-2000 | N38: публицистика , нехудожественная | O38: мемуары | Q38: Виктор Розов. Удивление перед жизнью | R38: 2000 | S38: книга | T38: омонимия не снята | U38: с | V38: прош. | W38: неопр.л.ед.ч. | X38: Лицо | Y38: Абстрактный объект | Z38: NA | AA38: Может быть, я все спутал и это было не с вами, а с Катаевым, Граниным или даже со мной, ― не в этом дело. [Виктор Розов. Удивление перед жизнью (1960-2000)] [омонимия не снята]
A39: 42.040083963381669 | B39: яам 52 радУ хакур в | C39: латупс | D39: в руках. Удар 25 мая | E39: спутал | G39: все карты. И до октября | H39: Б. Г. Бажанов. Воспоминания бывшего секретаря Сталина (1980) | I39: 1 | J39: Б. Г. Бажанов | K39: 1900 | L39: Воспоминания бывшего секретаря Сталина | M39: 1980 | N39: публицистика, нехудожественная | O39: мемуары | Q39: Борис Бажанов. Воспоминания бывшего секретаря Сталина | R39: 1992 | S39: книга | T39: омонимия не снята | U39: с | V39: прош. | W39: неопр.л.ед.ч. | X39: Абстрактный объект | Y39: Неодуш.конкрет.объект | Z39: NA | AA39: Но затем поправился, 27 марта 1922 года сделал на съезде политический отчет ЦК, и все держал в руках. Удар 25 мая спутал все карты. И до октября 1922 года Ленин практически был не у дел, и заключение врачей (конечно, секретное, для членов Политбюро, а не для страны) было, что это начало конца. [Б. Г. Бажанов. Воспоминания бывшего секретаря Сталина (1980)] [омонимия не снята]
A40: 46.234171484611572 | B40: ачярогс укитЭ | C40: латупс | D40: Этику сгоряча | E40: спутал | G40: с эстетикой ― такой необдуманный, но | H40: С. Б. Рассадин. Книга прощаний. Воспоминания о друзьях и не только о них (2004-2008) | I40: 1 | J40: С. Б. Рассадин | K40: 1935 | L40: Книга прощаний. Воспоминания о друзьях и не только о них | M40: 2004-2008 | N40: публицистика, нехудожественная | O40: мемуары | P40: искусство и культура, частная жизнь, администрация и управление | Q40: Рассадин С. Б. Книга прощаний. Воспоминания. М.: Текст, 2009 | R40: 2009 | S40: книга | T40: омонимия не снята | U40: с | V40: прош. | W40: неопр.л.ед.ч. | X40: Лицо | Y40: Абстрактный объект | Z40: Абстрактный объект | AA40: Этику сгоряча спутал с эстетикой ― такой необдуманный, но и такой понятный порыв тонко чувствующего интеллигента… [С. Б. Рассадин. Книга прощаний. Воспоминания о друзьях и не только о них (2004-2008)] [омонимия не снята]
A41: 11.028756963272823 | B41: янем от-мек с ыТ китоК | C41: алатупс | D41: Котик? Ты с кем-то меня | E41: спутала | F41: . | G41: ― Брось! | H41: Виорель Ломов. Музей // «Октябрь», 2002 | I41: #REF! | J41: Виорель Ломов | L41: Музей | M41: 2002 | N41: художественная | O41: повесть | Q41: «Октябрь» | R41: 2002 | S41: журнал | T41: омонимия не снята | U41: с | V41: прош. | W41: неопр.л.ед.ч. | X41: Лицо | Y41: Лицо | Z41: Лицо | AA41: ― Котик? Ты с кем-то меня спутала. ― Брось! [Виорель Ломов. Музей // «Октябрь», 2002] [омонимия не снята]
A42: 28.438078138697787 | B42: окьлоТ иизанмиг ароткерид аныс ушаС | C42: алатупс | D42: Сашу, сына директора гимназии. Только | E42: спутала | G42: сначала маму с Аней. Две | H42: З. И. Воскресенская. Сердце матери (1963-1965) | I42: 1 | J42: З. И. Воскресенская | K42: 1907 | L42: Сердце матери | M42: 1963-1965 | N42: художественная | O42: повесть | Q42: Воскресенская З. И. Сердце матери | R42: 1986 | S42: книга | T42: омонимия не снята | U42: с | V42: прош. | W42: неопр.л.ед.ч. | X42: Лицо | Y42: Лицо | Z42: Лицо | AA42: В барышне-крестьянке она сразу угадала Олину подружку Сашу Щербо, в Дон Кихоте ― Митиного приятеля Алешу Яковлева и, конечно, узнала в маленьком гноме пятилетнего Сашу, сына директора гимназии. Только спутала сначала маму с Аней. Две тоненькие елочки, закутанные в зеленую бахрому, танцевали лучше всех, но у мамы-елочки из-под зеленой шляпы выбилась белая прядь волос. [З. И. Воскресенская. Сердце матери (1963-1965)] [омонимия не снята]
A43: 29.361588790875302 | B43: ынвонавИ ыниН аругиф итаК и | C43: алатупс | D43: и Кати, фигура Нины Ивановны | E43: спутала | G43: ее мысли. | H43: Татьяна Моспан. Подиум (2000) | I43: #REF! | J43: Татьяна Моспан | L43: Подиум | M43: 2000 | N43: художественная | O43: роман | Q43: Татьяна Моспан. Подиум | R43: 2000 | S43: книга | T43: омонимия не снята | U43: с | V43: прош. | W43: неопр.л.ед.ч. | X43: Абстрактный объект | Y43: Абстрактный объект | Z43: NA | AA43: Катя хотела что-то спросить, но не успела: внезапно вынырнувшая откуда-то сзади, из-за спин Наташи и Кати, фигура Нины Ивановны спутала ее мысли. [Татьяна Моспан. Подиум (2000)] [омонимия не снята]
A44: 10.329702884296077 | B44: ил отч алахеоп ашырк хесв | C44: илатупС | D44: всех крыша поехала, что ли? | E44: Спутали | G44: вы меня с кем-то! ― Мы | H44: Н. Леонов, А. Макеев. Гроссмейстер сыска (2003) | I44: 1 | J44: Н. Леонов, А. Макеев | K44: 1933 | L44: Гроссмейстер сыска | M44: 2003 | N44: художественная | O44: роман | Q44: Н. Леонов, А. Макеев. Гроссмейстер сыска | R44: 2003 | S44: книга | T44: омонимия не снята | U44: с | V44: прош. | W44: неопр.л.мн.ч. | X44: Лицо | Y44: Лицо | Z44: Лицо | AA44: ― У вас у всех крыша поехала, что ли? Спутали вы меня с кем-то! ― Мы, может, и спутали, ― заметил Гуров. [Н. Леонов, А. Макеев. Гроссмейстер сыска (2003)] [омонимия не снята]
A45: 13.151087146148853 | B45: от-мек с отч мот о | C45: илатупс | D45: о том, что с кем-то | E45: спутали | F45: , | G45: лучше не заикаться, ― убили и | H45: Владимир Маканин. Голоса (1977) | I45: 1 | J45: Владимир Маканин | K45: 1937 | L45: Голоса | M45: 1977 | N45: художественная | O45: повесть | Q45: Маканин В. Лаз | R45: 1998 | S45: книга | T45: омонимия не снята | U45: с | V45: прош. | W45: неопр.л.мн.ч. | X45: Лицо | Y45: Лицо | Z45: Лицо | AA45: Она понимала, что голосить можно, плакать можно, убиваться можно, но ни о Божьей матушке, ни о том, что с кем-то спутали, лучше не заикаться, ― убили и убили, земля ему пухом. [Владимир Маканин. Голоса (1977)] [омонимия не снята]
A46: 30.295229970028849 | B46: чивотодеФ римидалВ | C46: илатупс | D46: ― Владимир Федотович, | E46: спутали | F46: , | G46: за кого-то другого приняли… ― Не | H46: Павел Сиркес. Труба исхода (1990-1999) | I46: 1 | J46: Павел Сиркес | K46: 1932 | L46: Труба исхода | M46: 1990-1999 | N46: публицистика , нехудожественная | O46: мемуары | S46: электронный текст | T46: омонимия не снята | U46: с | V46: прош. | W46: неопр.л.мн.ч. | X46: NA | Y46: NA | Z46: NA | AA46: ― Владимир Федотович, спутали, за кого-то другого приняли… ― Не спутал ― мы с тобой воевали. ― Вы с отцом моим воевали. [Павел Сиркес. Труба исхода (1990-1999)] [омонимия не снята]
A47: 32.43925748613281 | B47: ытрак есв морту ми ым | C47: илатупс | D47: мы им утром все карты | E47: спутали | F47: . | H47: Константин Симонов. Так называемая личная жизнь/ Четыре шага (1956-1965) | I47: 1 | J47: Константин Симонов | K47: 1915 | L47: Так называемая личная жизнь/ Четыре шага | M47: 1956-1965 | N47: художественная | O47: повесть | Q47: Симонов К. М. Собр. соч.: В 10 т. Т.7 | R47: 1982 | S47: книга | T47: омонимия не снята | U47: с | V47: прош. | W47: неопр.л.мн.ч. | X47: Лицо | Y47: Неодуш.конкрет.объект | Z47: NA | AA47: Показывает, что мы им утром все карты спутали. [Константин Симонов. Так называемая личная жизнь/ Четыре шага (1956-1965)] [омонимия не снята]
A48: 35.548374681653485 | B48: ыреткатнок еонреваН | C48: илатупс | D48: Наверное, контактеры | E48: спутали | G48: созвездие со звездным скоплением. | H48: Феликс Эльдемуров. Беседы о спиритизме // «Наука и религия», 1992 | I48: 1 | J48: Феликс Эльдемуров | K48: 1957 | L48: Беседы о спиритизме | M48: 1992 | N48: публицистика, нехудожественная | O48: статья | P48: астрология, парапсихология, эзотерика | Q48: «Наука и религия» | R48: 1992 | S48: журнал | T48: омонимия не снята | U48: с | V48: прош. | W48: неопр.л.мн.ч. | X48: Лицо | Y48: Неодуш.конкрет.объект | Z48: Неодуш.конкрет.объект | AA48: Наверное, контактеры спутали созвездие со звездным скоплением. [Феликс Эльдемуров. Беседы о спиритизме // «Наука и религия», 1992] [омонимия не снята]
A49: 46.042256945891111 | B49: кафбар ино умеовс увтсежевен оп | C49: илатупс | D49: по невежеству своему они рабфак | E49: спутали | G49: с домзаком…" | H49: Анатолий Азольский. Лопушок // «Новый Мир», 1998 | I49: #REF! | J49: Анатолий Азольский | K49: 1930 | L49: Лопушок | M49: 1998 | N49: художественная | O49: роман | Q49: «Новый Мир» | R49: 1998 | S49: журнал | T49: омонимия снята | U49: с | V49: прош. | W49: неопр.л.мн.ч. | X49: Лицо | Y49: Абстрактный объект | Z49: Абстрактный объект | AA49: Неблагодарные односельчане послали его в город, на рабфак, по невежеству своему они рабфак спутали с домзаком…" [Анатолий Азольский. Лопушок // «Новый Мир», 1998] [омонимия снята]
A50: 1.9316835637120944 | B50: окгел ьсюак от Я | C50: юатупс | D50: Я-то, каюсь, легко | E50: спутаю | G50: иланг-иланг с, допустим, ветивьером. | H50: Катя Метелица. Запах Мэра (1997) // «Столица», 1997.04.01 | I50: 1 | J50: Катя Метелица | L50: Запах Мэра | M50: 1997 | N50: публицистика , нехудожественная | O50: статья | P50: производство | Q50: «Столица» | R50: 1997.04.01 | S50: журнал | T50: омонимия не снята | U50: с | V50: буд. | W50: 1л.ед.ч | X50: Лицо | Y50: Неодуш.конкрет.объект | Z50: Неодуш.конкрет.объект | AA50: Я-то, каюсь, легко спутаю иланг-иланг с, допустим, ветивьером. [Катя Метелица. Запах Мэра (1997) // «Столица», 1997.04.01] [омонимия не снята]
A51: 23.426869509338154 | B51: ен мигурд микак с ин | C51: юатупс | D51: ни с каким другим не | E51: спутаю | F51: . | H51: Владимир Соловьев. Три еврея, или Утешение в слезах. Роман с эпиграфами (1975-1998) | I51: 1 | J51: Владимир Соловьев | K51: 1942 | L51: Три еврея, или Утешение в слезах. Роман с эпиграфами | M51: 1975-1998 | N51: художественная | O51: роман | Q51: Владимир Соловьев. Три еврея, или Утешение в слезах. Роман с эпиграфами | R51: 2002 | S51: книга | T51: омонимия не снята | U51: с | V51: буд. | W51: 1л.ед.ч | X51: Лицо | Y51: NA | Z51: Лицо | AA51: Это все равно кто ― грузчик, секретарь Союза писателей, генеральный секретарь партии ― почерк один и тот же, я его легко узнаю, ни с каким другим не спутаю. [Владимир Соловьев. Три еврея, или Утешение в слезах. Роман с эпиграфами (1975-1998)] [омонимия не снята]

Sheet: 3.1(а)
A3: Количество по полю PREFIX | B3: Названия столбцов
A4: Названия строк | B4: пере | C4: с | D4: Общий итог
A5: буд. | B5: 1 | C5: 6 | D5: 7
A6: прош. | B6: 24 | C6: 19 | D6: 43
A7: Общий итог | B7: 25 | C7: 25 | D7: 50

Sheet: 3.1(б)
A3: Количество по полю PERSONNUMBER | B3: Названия столбцов
A4: Названия строк | B4: 1л.ед.ч | C4: 2л.ед.ч. | D4: неопр.л.ед.ч. | E4: неопр.л.мн.ч. | F4: (пусто) | G4: Общий итог
A5: пере | C5: 1 | D5: 20 | E5: 4 | G5: 25
A6: с | B6: 2 | C6: 4 | D6: 13 | E6: 6 | G6: 25
A7: (пусто)
A8: Общий итог | B8: 2 | C8: 5 | D8: 33 | E8: 10 | G8: 50

Sheet: 3.1(в)
A3: Количество по полю PREFIX | B3: Названия столбцов
B4: буд. | D4: буд. Итог | E4: прош. | G4: прош. Итог | H4: Общий итог
A5: Названия строк | B5: 1л.ед.ч | C5: 2л.ед.ч. | E5: неопр.л.ед.ч. | F5: неопр.л.мн.ч.
A6: пере | C6: 1 | D6: 1 | E6: 20 | F6: 4 | G6: 24 | H6: 25
A7: с | B7: 2 | C7: 4 | D7: 6 | E7: 13 | F7: 6 | G7: 19 | H7: 25
A8: Общий итог | B8: 2 | C8: 5 | D8: 7 | E8: 33 | F8: 10 | G8: 43 | H8: 50

Sheet: 3.2(а)
A3: Количество по полю PREFIX | B3: Названия столбцов
A4: Названия строк | B4: пере | C4: с | D4: Общий итог
A5: NA | B5: 4 | C5: 5 | D5: 9
A6: Абстрактный объект | B6: 1 | C6: 2 | D6: 3
A7: Лицо | B7: 20 | C7: 17 | D7: 37
A8: Неодуш.конкрет.объект | C8: 1 | D8: 1
A9: Общий итог | B9: 25 | C9: 25 | D9: 50

Sheet: 3.2(б)
A3: Количество по полю PREFIX | B3: Названия столбцов
A4: Названия строк | B4: NA | C4: Абстрактный объект | D4: Животное | E4: Лицо | F4: Место | G4: Неодуш.конкрет.объект | H4: Общий итог
A5: пере | B5: 6 | C5: 12 | D5: 1 | E5: 2 | G5: 4 | H5: 25
A6: с | B6: 5 | C6: 7 | E6: 7 | F6: 1 | G6: 5 | H6: 25
A7: Общий итог | B7: 11 | C7: 19 | D7: 1 | E7: 9 | F7: 1 | G7: 9 | H7: 50

Sheet: 3.3
A1: Год | B1: Количество ПЕРЕ | M1: Год | N1: Количество С
A2: 1959 | B2: 1 | M2: 1955 | N2: 1
A3: 1966 | B3: 1 | M3: 1956-1965 | N3: 1
A4: 1973 | B4: 1 | M4: 1958-1973 | N4: 1
A5: 1975 | B5: 1 | M5: 1959 | N5: 1
A6: 1980-1990 | B6: 1 | M6: 1960 | N6: 1
A7: 1987 | B7: 1 | M7: 1960-2000 | N7: 1
A8: 1989 | B8: 1 | M8: 1963-1965 | N8: 1
A9: 1991-1995 | B9: 1 | M9: 1966-1970 | N9: 1
A10: 1995 | B10: 1 | M10: 1975-1998 | N10: 1
A11: 1997 | B11: 2 | M11: 1977 | N11: 1
A12: 1998 | B12: 1 | M12: 1980 | N12: 1
A13: 2000-2002 | B13: 1 | M13: 1990-1999 | N13: 1
A14: 2001 | B14: 2 | M14: 1992 | N14: 1
A15: 2002 | B15: 3 | M15: 1997 | N15: 1
A16: 2003 | B16: 1 | M16: 1998 | N16: 1
A17: 2005 | B17: 1 | M17: 1999 | N17: 1
A18: 2008 | B18: 1 | M18: 2000 | N18: 1
A19: 2009 | B19: 1 | M19: 2002 | N19: 1
A20: 2010 | B20: 1 | M20: 2002-2004 | N20: 1
A21: 2012 | B21: 1 | M21: 2003 | N21: 3
A22: 2015 | B22: 1 | M22: 2004-2008 | N22: 1
M23: 2008 | N23: 1
M24: 2011 | N24: 1